{
  "$ref": "#/definitions/Warp",
  "$schema": "http://json-schema.org/draft-07/schema#",
  "definitions": {
    "Warp": {
      "additionalProperties": false,
      "properties": {
        "actions": {
          "items": {
            "$ref": "#/definitions/WarpAction"
          },
          "type": "array"
        },
        "bot": {
          "type": "string"
        },
        "chain": {
          "$ref": "#/definitions/WarpChain"
        },
        "description": {
          "anyOf": [
            {
              "$ref": "#/definitions/WarpText"
            },
            {
              "type": "null"
            }
          ]
        },
        "messages": {
          "additionalProperties": {
            "type": "string"
          },
          "type": "object"
        },
        "meta": {
          "$ref": "#/definitions/WarpMeta"
        },
        "name": {
          "type": "string"
        },
        "next": {
          "type": "string"
        },
        "preview": {
          "type": "string"
        },
        "protocol": {
          "type": "string"
        },
        "results": {
          "additionalProperties": {
            "$ref": "#/definitions/WarpResulutionPath"
          },
          "type": "object"
        },
        "title": {
          "$ref": "#/definitions/WarpText"
        },
        "vars": {
          "additionalProperties": {
            "type": "string"
          },
          "type": "object"
        }
      },
      "required": ["protocol", "name", "title", "description", "actions"],
      "type": "object"
    },
    "WarpAction": {
      "anyOf": [
        {
          "$ref": "#/definitions/WarpTransferAction"
        },
        {
          "$ref": "#/definitions/WarpContractAction"
        },
        {
          "$ref": "#/definitions/WarpQueryAction"
        },
        {
          "$ref": "#/definitions/WarpCollectAction"
        },
        {
          "$ref": "#/definitions/WarpLinkAction"
        }
      ]
    },
    "WarpActionInput": {
      "additionalProperties": false,
      "properties": {
        "as": {
          "type": "string"
        },
        "bot": {
          "type": "string"
        },
        "default": {
          "type": ["string", "number", "boolean"]
        },
        "description": {
          "anyOf": [
            {
              "$ref": "#/definitions/WarpText"
            },
            {
              "type": "null"
            }
          ]
        },
        "label": {
          "$ref": "#/definitions/WarpText"
        },
        "max": {
          "anyOf": [
            {
              "type": "number"
            },
            {
              "$ref": "#/definitions/WarpVarPlaceholder"
            }
          ]
        },
        "min": {
          "anyOf": [
            {
              "type": "number"
            },
            {
              "$ref": "#/definitions/WarpVarPlaceholder"
            }
          ]
        },
        "modifier": {
          "type": "string"
        },
        "name": {
          "type": "string"
        },
        "options": {
          "anyOf": [
            {
              "items": {
                "type": "string"
              },
              "type": "array"
            },
            {
              "additionalProperties": {
                "type": "string"
              },
              "type": "object"
            }
          ]
        },
        "pattern": {
          "type": "string"
        },
        "patternDescription": {
          "$ref": "#/definitions/WarpText"
        },
        "position": {
          "$ref": "#/definitions/WarpActionInputPosition"
        },
        "required": {
          "type": "boolean"
        },
        "source": {
          "$ref": "#/definitions/WarpActionInputSource"
        },
        "type": {
          "$ref": "#/definitions/WarpActionInputType"
        }
      },
      "required": ["name", "type", "source"],
      "type": "object"
    },
    "WarpActionInputPosition": {
      "type": "string"
    },
    "WarpActionInputSource": {
      "enum": ["field", "query", "user:wallet", "hidden"],
      "type": "string"
    },
    "WarpActionInputType": {
      "type": "string"
    },
    "WarpActionType": {
      "enum": ["transfer", "contract", "query", "collect", "link"],
      "type": "string"
    },
    "WarpChain": {
      "type": "string"
    },
    "WarpCollectAction": {
      "additionalProperties": false,
      "properties": {
        "auto": {
          "type": "boolean"
        },
        "description": {
          "anyOf": [
            {
              "$ref": "#/definitions/WarpText"
            },
            {
              "type": "null"
            }
          ]
        },
        "destination": {
          "additionalProperties": false,
          "properties": {
            "headers": {
              "additionalProperties": {
                "type": "string"
              },
              "type": "object"
            },
            "method": {
              "enum": ["GET", "POST", "PUT", "DELETE"],
              "type": "string"
            },
            "url": {
              "type": "string"
            }
          },
          "required": ["url"],
          "type": "object"
        },
        "inputs": {
          "items": {
            "$ref": "#/definitions/WarpActionInput"
          },
          "type": "array"
        },
        "label": {
          "$ref": "#/definitions/WarpText"
        },
        "next": {
          "type": "string"
        },
        "primary": {
          "type": "boolean"
        },
        "type": {
          "$ref": "#/definitions/WarpActionType"
        }
      },
      "required": ["type", "label", "destination"],
      "type": "object"
    },
    "WarpContractAction": {
      "additionalProperties": false,
      "properties": {
        "abi": {
          "type": "string"
        },
        "address": {
          "type": "string"
        },
        "args": {
          "items": {
            "type": "string"
          },
          "type": "array"
        },
        "auto": {
          "type": "boolean"
        },
        "description": {
          "anyOf": [
            {
              "$ref": "#/definitions/WarpText"
            },
            {
              "type": "null"
            }
          ]
        },
        "func": {
          "type": ["string", "null"]
        },
        "gasLimit": {
          "type": "number"
        },
        "inputs": {
          "items": {
            "$ref": "#/definitions/WarpActionInput"
          },
          "type": "array"
        },
        "label": {
          "$ref": "#/definitions/WarpText"
        },
        "next": {
          "type": "string"
        },
        "primary": {
          "type": "boolean"
        },
        "transfers": {
          "items": {
            "type": "string"
          },
          "type": "array"
        },
        "type": {
          "$ref": "#/definitions/WarpActionType"
        },
        "value": {
          "type": "string"
        }
      },
      "required": ["type", "label", "gasLimit"],
      "type": "object"
    },
    "WarpI18nText": {
      "additionalProperties": {
        "type": "string"
      },
      "type": "object"
    },
    "WarpLinkAction": {
      "additionalProperties": false,
      "properties": {
        "auto": {
          "type": "boolean"
        },
        "description": {
          "anyOf": [
            {
              "$ref": "#/definitions/WarpText"
            },
            {
              "type": "null"
            }
          ]
        },
        "inputs": {
          "items": {
            "$ref": "#/definitions/WarpActionInput"
          },
          "type": "array"
        },
        "label": {
          "$ref": "#/definitions/WarpText"
        },
        "primary": {
          "type": "boolean"
        },
        "type": {
          "$ref": "#/definitions/WarpActionType"
        },
        "url": {
          "type": "string"
        }
      },
      "required": ["type", "label", "url"],
      "type": "object"
    },
    "WarpMeta": {
      "additionalProperties": false,
      "properties": {
        "chain": {
          "$ref": "#/definitions/WarpChain"
        },
        "createdAt": {
          "type": "string"
        },
        "creator": {
          "type": "string"
        },
        "hash": {
          "type": "string"
        }
      },
      "required": ["chain", "hash", "creator", "createdAt"],
      "type": "object"
    },
    "WarpQueryAction": {
      "additionalProperties": false,
      "properties": {
        "abi": {
          "type": "string"
        },
        "address": {
          "type": "string"
        },
        "args": {
          "items": {
            "type": "string"
          },
          "type": "array"
        },
        "auto": {
          "type": "boolean"
        },
        "description": {
          "anyOf": [
            {
              "$ref": "#/definitions/WarpText"
            },
            {
              "type": "null"
            }
          ]
        },
        "func": {
          "type": "string"
        },
        "inputs": {
          "items": {
            "$ref": "#/definitions/WarpActionInput"
          },
          "type": "array"
        },
        "label": {
          "$ref": "#/definitions/WarpText"
        },
        "next": {
          "type": "string"
        },
        "primary": {
          "type": "boolean"
        },
        "type": {
          "$ref": "#/definitions/WarpActionType"
        }
      },
      "required": ["type", "label"],
      "type": "object"
    },
    "WarpResulutionPath": {
      "type": "string"
    },
    "WarpText": {
      "anyOf": [
        {
          "type": "string"
        },
        {
          "$ref": "#/definitions/WarpI18nText"
        }
      ]
    },
    "WarpTransferAction": {
      "additionalProperties": false,
      "properties": {
        "address": {
          "type": "string"
        },
        "auto": {
          "type": "boolean"
        },
        "data": {
          "type": "string"
        },
        "description": {
          "anyOf": [
            {
              "$ref": "#/definitions/WarpText"
            },
            {
              "type": "null"
            }
          ]
        },
        "inputs": {
          "items": {
            "$ref": "#/definitions/WarpActionInput"
          },
          "type": "array"
        },
        "label": {
          "$ref": "#/definitions/WarpText"
        },
        "next": {
          "type": "string"
        },
        "primary": {
          "type": "boolean"
        },
        "transfers": {
          "items": {
            "type": "string"
          },
          "type": "array"
        },
        "type": {
          "$ref": "#/definitions/WarpActionType"
        },
        "value": {
          "type": "string"
        }
      },
      "required": ["type", "label"],
      "type": "object"
    },
    "WarpVarPlaceholder": {
      "type": "string"
    }
  }
}
