{
  "protocol": "warp:2.0.0",
  "name": "MultiversX Staking: Claim Rewards",
  "title": "Claim Staking Rewards",
  "description": "Claim staking rewards for the current user.",
  "vars": {
    "CONTRACT_ADDRESS": "query:contract"
  },
  "actions": [
    {
      "type": "contract",
      "label": "Claim now",
      "address": "{{CONTRACT_ADDRESS}}",
      "func": "claimRewards",
      "args": [],
      "gasLimit": 10000000
    }
  ],
  "messages": {
    "success": "Rewards claimed successfully"
  }
}
