{
  "protocol": "warp:2.0.0",
  "name": "MultiversX Staking: Stake",
  "title": "Stake eGold",
  "description": "Stake eGold to secure the network and earn rewards.",
  "vars": {
    "CONTRACT_ADDRESS": "query:contract"
  },
  "actions": [
    {
      "type": "contract",
      "label": "Stake now",
      "address": "{{CONTRACT_ADDRESS}}",
      "func": "delegate",
      "args": [],
      "gasLimit": 10000000,
      "inputs": [
        {
          "name": "value",
          "description": "Amount of eGold to delegate.",
          "type": "biguint",
          "position": "value",
          "source": "field",
          "required": true,
          "min": 1,
          "modifier": "scale:18"
        }
      ]
    },
    {
      "type": "link",
      "label": "Learn more",
      "description": "Find more information about staking eGold.",
      "url": "https://multiversx.com/egld"
    }
  ],
  "messages": {
    "success": "eGold staked successfully"
  }
}
